{"after":{"contract_fingerprint":"sha256:c0f78266f728d09fab4ca2720b392f7826d2ec55d5b84ddd651acd41bafa6209","contract_id":"contract:m4-synthetic-review","evidence_refs":["evidence:m4:after-test"],"fingerprint":"sha256:3cdc7c055d0921ca070ec581e625b1b8eda4bdd65f9dbe27b6fa57d75a52b54e","observed_at":"2026-09-06T12:00:00+00:00","receipts":[{"basis":"observed","classification":"regression","code_refs":["tests/test_widget.py"],"command_fingerprint":"sha256:1d3c4b05d4d05785cea1f36a09a05beff639701251163d242ec23c0d90fd48e3","conflict_refs":[],"contract_fingerprint":"sha256:c0f78266f728d09fab4ca2720b392f7826d2ec55d5b84ddd651acd41bafa6209","criterion_id":"tests_pass","environment_fingerprint":"sha256:1b50abff1d9c63dce89ad51fd127acf6c6e2651945e5d2b4c73584119b1bf4d0","evidence_refs":["evidence:m4:after-test"],"result":"pass","selection_scope":"tests/test_widget.py","start_patch_hash":"sha256:b393525b59216600b0cdc05a6b06ae3bafdce84f969d88ef9f82f9dce161079e","target_patch_hash":"sha256:48df565c244f901a74092afec72b5f666f4972cd0c051fbc06186b2d3d36a223","test_id":"test:widget-regression","validation_command":"python -m unittest discover -s tests -v"}],"selection_fingerprint":"sha256:054f324c726c02d96e138992b400669c5d0ba64d17e0f4b256865404204a2e02","task_id":"task:m4-fixture","test_run_version":"1.0"},"before":{"contract_fingerprint":"sha256:c0f78266f728d09fab4ca2720b392f7826d2ec55d5b84ddd651acd41bafa6209","contract_id":"contract:m4-synthetic-review","evidence_refs":["evidence:m4:before-test"],"fingerprint":"sha256:87040c456931713125847e5fdbaac6d13fbe420fe5ec109a3d5d6a1fb143e508","observed_at":"2026-09-06T12:00:00+00:00","receipts":[{"basis":"observed","classification":"regression","code_refs":["tests/test_widget.py"],"command_fingerprint":"sha256:1d3c4b05d4d05785cea1f36a09a05beff639701251163d242ec23c0d90fd48e3","conflict_refs":[],"contract_fingerprint":"sha256:c0f78266f728d09fab4ca2720b392f7826d2ec55d5b84ddd651acd41bafa6209","criterion_id":"tests_pass","environment_fingerprint":"sha256:1b50abff1d9c63dce89ad51fd127acf6c6e2651945e5d2b4c73584119b1bf4d0","evidence_refs":["evidence:m4:before-test"],"result":"pass","selection_scope":"tests/test_widget.py","start_patch_hash":"sha256:b393525b59216600b0cdc05a6b06ae3bafdce84f969d88ef9f82f9dce161079e","target_patch_hash":"sha256:48df565c244f901a74092afec72b5f666f4972cd0c051fbc06186b2d3d36a223","test_id":"test:widget-regression","validation_command":"python -m unittest discover -s tests -v"}],"selection_fingerprint":"sha256:054f324c726c02d96e138992b400669c5d0ba64d17e0f4b256865404204a2e02","task_id":"task:m4-fixture","test_run_version":"1.0"},"comparison":{"after_ref":"sha256:3cdc7c055d0921ca070ec581e625b1b8eda4bdd65f9dbe27b6fa57d75a52b54e","before_ref":"sha256:87040c456931713125847e5fdbaac6d13fbe420fe5ec109a3d5d6a1fb143e508","comparison_version":"1.0","comparisons":[{"classification":"regression","criterion_id":"tests_pass","evidence_refs":["evidence:m4:after-test","evidence:m4:before-test"],"status":"comparable_pass","test_id":"test:widget-regression"}],"contract_fingerprint":"sha256:c0f78266f728d09fab4ca2720b392f7826d2ec55d5b84ddd651acd41bafa6209","contract_id":"contract:m4-synthetic-review","fingerprint":"sha256:400af9e1c8bba1846ef28001ed786dacd95c538c922094da8cb428f4880cbc27"},"contract_fingerprint":"sha256:c0f78266f728d09fab4ca2720b392f7826d2ec55d5b84ddd651acd41bafa6209","contract_id":"contract:m4-synthetic-review","evidence_refs":["evidence:m4:after-test","evidence:m4:before-test","evidence:m4:requirements","evidence:m4:test-map"],"fingerprint":"sha256:c4985aaa07413fb3dc6ad594f707c920c8c43777816ccc72ff5ea255c2132975","gaps":{"contract_fingerprint":"sha256:c0f78266f728d09fab4ca2720b392f7826d2ec55d5b84ddd651acd41bafa6209","contract_id":"contract:m4-synthetic-review","fingerprint":"sha256:e442ad0cf48f002c2fa88ccde6e7e0759d36bd1b0b0fa4aefd7fef4af1d15fc8","gap_report_version":"1.0","gaps":[]},"gate":{"basis":"unobserved","contract_fingerprint":"sha256:c0f78266f728d09fab4ca2720b392f7826d2ec55d5b84ddd651acd41bafa6209","contract_id":"contract:m4-synthetic-review","decision":"soft_block","evidence_refs":["evidence:m4:after-test","evidence:m4:before-test"],"fingerprint":"sha256:0832e64e1a02e1c6c41083c6557b1b43689742b564dd526a4da9b497ba5a748e","gate_version":"1.0","hard_reasons":[],"initial_decision":"soft_block","override":{"status":"not_requested"},"soft_reasons":["Unobserved dynamic_runtime_relationships: the fixture does not claim complete dependency discovery"]},"impact":{"analysis_scope":"actual tracked Git diff joined to declared relations","changed_paths":[{"basis":"observed","path":"widget.py","status":"M"}],"claims_complete_dependency_analysis":false,"contract_fingerprint":"sha256:c0f78266f728d09fab4ca2720b392f7826d2ec55d5b84ddd651acd41bafa6209","contract_id":"contract:m4-synthetic-review","exclusions":[{"area":"dynamic_runtime_relationships","basis":"unobserved","reason":"v1 joins declared relations only"},{"area":"external_services","basis":"unobserved","reason":"the fixture invokes no external service"},{"area":"submodules","basis":"unobserved","reason":"submodule working trees are not reconstructed"},{"area":"symbolic_links","basis":"unobserved","reason":"link targets are not captured or followed"},{"area":"untracked_content","basis":"unobserved","reason":"Git tracked patch excludes untracked files"}],"fingerprint":"sha256:6519af4de7a41ae150850f21a178b12912b0b6000884bdb70cb926d874e1baa8","impact_version":"1.0","observed_at":"2026-09-06T12:00:00+00:00","protected_target_changes":[],"relations":[{"basis":"declared","changed_paths":["widget.py"],"evidence_refs":["evidence:m4:requirements"],"relation_id":"relation:widget-feature","relation_type":"feature","target_ref":"feature:string-validation"},{"basis":"declared","changed_paths":["widget.py"],"evidence_refs":["evidence:m4:test-map"],"relation_id":"relation:widget-test","relation_type":"test","required_classification":"regression","target_ref":"test:widget-regression"}],"restore_point_ref":"restore:b40279bb58f721a361addbb81d5972adad60d9b6672600ed5cdde9f058c5cd3f","unobserved":[{"area":"dynamic_runtime_relationships","basis":"unobserved","reason":"the fixture does not claim complete dependency discovery"}]},"input_fingerprint":"sha256:1de4a684b2f0240f5c6a4e998b6ad0f99096ae322a19b655668a6d8914d7caed","observed_at":"2026-09-06T12:00:00+00:00","packet_id":"assurance:1de4a684b2f0240f5c6a4e998b6ad0f99096ae322a19b655668a6d8914d7caed","packet_version":"1.0","restore_point":{"exclusions":[{"area":"untracked_content","basis":"unobserved","reason":"Git tracked patch excludes untracked files"},{"area":"submodules","basis":"unobserved","reason":"submodule working trees are not reconstructed"},{"area":"symbolic_links","basis":"unobserved","reason":"link targets are not captured or followed"}],"observed_at":"2026-09-06T12:00:00+00:00","restore_point_id":"restore:b40279bb58f721a361addbb81d5972adad60d9b6672600ed5cdde9f058c5cd3f","restore_point_version":"1.0","scope":"local_tracked_git_workspace","start_commit":"55d7dedb31c61b2b963dfe9de7d782a4d39562ea","start_patch_hash":"sha256:b393525b59216600b0cdc05a6b06ae3bafdce84f969d88ef9f82f9dce161079e","task":{"environment_ref":"python-3.12-local-fixture","project_id":"project:ownhands-fixture","task_id":"task:m4-fixture","worktree_id":"worktree:m4-fixture"},"tracked_patch_hash":"sha256:48df565c244f901a74092afec72b5f666f4972cd0c051fbc06186b2d3d36a223","tracked_patch_size":257},"restore_verification":{"basis":"observed","evidence_refs":[],"exclusions":[{"area":"untracked_content","basis":"unobserved","reason":"Git tracked patch excludes untracked files"},{"area":"submodules","basis":"unobserved","reason":"submodule working trees are not reconstructed"},{"area":"symbolic_links","basis":"unobserved","reason":"link targets are not captured or followed"}],"method":"disposable_local_clone_reconstruction","reconstructed_patch_hash":"sha256:48df565c244f901a74092afec72b5f666f4972cd0c051fbc06186b2d3d36a223","restore_point_ref":"restore:b40279bb58f721a361addbb81d5972adad60d9b6672600ed5cdde9f058c5cd3f","result":"pass","source_worktree_unchanged":true,"task":{"environment_ref":"python-3.12-local-fixture","project_id":"project:ownhands-fixture","task_id":"task:m4-fixture","worktree_id":"worktree:m4-fixture"},"verification_version":"1.0"},"task":{"environment_ref":"python-3.12-local-fixture","goal":"Exercise the local M4 assurance review slice","mode":"managed","project_id":"project:ownhands-fixture","task_id":"task:m4-fixture","worktree_id":"worktree:m4-fixture"},"test_design":{"contract_fingerprint":"sha256:c0f78266f728d09fab4ca2720b392f7826d2ec55d5b84ddd651acd41bafa6209","contract_id":"contract:m4-synthetic-review","design_version":"1.0","fingerprint":"sha256:1a3c69d2e078e7595a634dba4068630d31f8945aef3e70fa71ea706717d8181e","impact_fingerprint":"sha256:6519af4de7a41ae150850f21a178b12912b0b6000884bdb70cb926d874e1baa8","mappings":[{"block_level":"hard","criterion_id":"tests_pass","omitted_viewpoints":[],"reason":"the existing normalization behavior must remain stable","required_viewpoints":["regression","recovery"],"selected_viewpoints":["regression","recovery"],"tests":[{"classification":"regression","code_refs":["tests/test_widget.py"],"command":"python -m unittest discover -s tests -v","selection_scope":"tests/test_widget.py","test_id":"test:widget-regression"}]}],"selected_tests":[{"classification":"regression","code_refs":["tests/test_widget.py"],"command":"python -m unittest discover -s tests -v","selection_scope":"tests/test_widget.py","test_id":"test:widget-regression"}]}}
